{
  "schema_version": "t2v-ab-experiment-config-v1",
  "config_status": "RUNNABLE",
  "study_id": "ab-single-lesson-integrated-v1",
  "run_id": "20261018-lesson002-integrated-ab-development-r1",
  "mode": "development",
  "git": {
    "branch": "codex/ab-research-handoff-20261017",
    "require_clean": true,
    "require_pushed": true
  },
  "dataset": {
    "dataset_id": "ab-real-lessons-dev-v1",
    "split": "dev",
    "manifest": {
      "path": "datasets/research_generation_v2/frozen/ab-real-lessons-dev-v1/dataset_manifest.json",
      "sha256": "5b3c1fb444dac9ec1823a58adeb4e5988226369e73c2f19ed4a3f125e1f641c0"
    },
    "case_ids": ["lesson_002"]
  },
  "tracks": ["A", "B", "IntegratedAB"],
  "conditions": [
    {
      "condition_id": "baseline",
      "track": "IntegratedAB",
      "treatment": "baseline",
      "enabled_modules": []
    },
    {
      "condition_id": "p0",
      "track": "IntegratedAB",
      "treatment": "pedagogy-driven-p0",
      "enabled_modules": ["visual-decision", "dynamic-alignment", "signaling"]
    }
  ],
  "model": {
    "provider": "ecnu",
    "model_id": "ecnu-plus",
    "api_base_label": "ECNU_GATEWAY"
  },
  "frozen_inputs": {
    "research_schema": {
      "path": "contracts/research_generation_v2.schema.json",
      "sha256": "7e9c4327617d26934684c9e707a0168d52b2bf6ba9e59a2158a9ae14efe55116"
    },
    "prompts": [
      {
        "path": "src/textbook2video/research/binding_methods.py",
        "sha256": "a9eb0e7a3ac56b5099462663ab40eec7fdaba2cdd0f42062a45e751db7a0d433"
      },
      {
        "path": "src/textbook2video/research/dynamic_planner.py",
        "sha256": "f90aa0aa862b98dc532d2ae918ac10dee9838755e83c84e89707a40ec741c24f"
      },
      {
        "path": "src/textbook2video/research/p0_method_runner.py",
        "sha256": "e4ad423207e424d5862b97a9d22411b5509678efbab581a657a3a93c5393ab61"
      },
      {
        "path": "src/textbook2video/research/p0_integration.py",
        "sha256": "4bbba4ee72cb5eff9f7036f843dd75beab00a343b26e85e853d963864bc4c900"
      }
    ],
    "gold": {
      "path": "datasets/research_generation_v2/reference/a_visual_support_gold_v0.1/human_reviewed_gold.json",
      "sha256": "5e5b1dbd953eef0e5cf8a12ec7ec36a128c195b9b252f31c8af231ec29cb14de"
    },
    "gold_access_stage": "evaluation-only",
    "candidate_universe": {
      "path": "datasets/research_generation_v2/frozen/ab-real-lessons-dev-v1/manifests/candidate_universe.json",
      "sha256": "552e223386f417f1e047fb7d19c7df1ba368ba332dd616907dc471219317ad1d"
    },
    "candidate_subset": {
      "path": "datasets/research_generation_v2/frozen/ab-real-lessons-dev-v1/manifests/candidate_subset_track_b.json",
      "sha256": "3534ffe270c6a56bdc7f84fae0561ae62c673e2efc932f82e6710127d29d64d5"
    },
    "narration_manifest": {
      "path": "datasets/research_generation_v2/frozen/ab-real-lessons-dev-v1/manifests/narration_track_b.json",
      "sha256": "da8c603fad0cb52fcc9f9a83c8f8cc4c09a43f6c679263c4c64625e0782be51b"
    },
    "audio_manifest": {
      "path": "datasets/research_generation_v2/frozen/ab-real-lessons-dev-v1/manifests/audio_track_b.json",
      "sha256": "044638c0945c26d2d99b70b328b8ae8f20b62be77dde3b736e5877228a96e3bb"
    }
  },
  "fairness_controls": {
    "same_source": true,
    "same_narration": true,
    "same_audio": true,
    "same_theme": true,
    "same_duration_budget": true,
    "rq1_shared_candidate_universe": true,
    "rq2_shared_candidate_subset": true,
    "gold_available_to_generation": false
  },
  "execution": {
    "temperature": 0,
    "seeds": [0],
    "timeout_sec": 600,
    "max_retries": 0,
    "allow_fallback": false,
    "preserve_failures": true
  },
  "outputs": {
    "root": ".local/research_runs/ab-single-lesson-integrated-v1/20261018-lesson002-integrated-ab-development-r1",
    "refuse_existing": true
  },
  "locked_test_authorization": null
}
